title,company,experience,location,description,skills,posted
"Business Analyst, Retail Business Services (RBS) - Brand Experience",Amazon,5-7 Yrs,Bengaluru,Experience defining requirements and using data and metrics to draw business insights Y...,"Business services, customer segmentation, Business Analyst, Financial analysis, Machine learning, data visualization, Customer experience, Business intelligence",3+ weeks ago
Business Analyst Power BI,Novo Nordisk,3-5 Yrs,Bengaluru,We need to aspire to be the best company for the world and we know that this is only po...,"bi tools, python, data analysis, power bi dashboards, design, power bi, data visualization, Data",3+ weeks ago
Business Interlock Analyst,Accenture,3-5 Yrs,Bengaluru,Qualifications: Any Graduation Skill required: Talent Development - Instructor-Led Trai...,"business analysis, human resource management, talent development, talent management, recruitment, hr generalist activities, corporate hr, strategic hr",3 weeks ago
"Business Analyst- Picasso, Global Markets",BNP Paribas,5-10 Yrs,Bengaluru,Position PurposeIT Business Analyst for GM Non-US Corporate Actions (CoA) processing pl...,"equity derivatives, bonds, capital market, visio, cash sales, master data, investment banking, middle office",3 weeks ago
Lead Business Analyst - Collateral - Global Markets IT,BNP Paribas,5-10 Yrs,Bengaluru,"Position PurposeThe Collateral Management IT department comprises of project managers, ...","business analysis, sql, functional testing, visio, amadeus, strategic sourcing, international ticketing, tourism",3 weeks ago
Business Analyst,Accenture,3-8 Yrs,Bengaluru,Educational Qualification : 15 years full time education. Summary :As a Business Analys...,"business solutions, business analysis, business requirement analysis, process mapping, stakeholder management, project management, documentation, business analytics",3 weeks ago
Business Analyst,Accenture,3-8 Yrs,Bengaluru,Educational Qualification : 15 years full time education and Must have CSA and CSSA cer...,"project management, pega platform, business analysis, process mapping, pega, pega prpc, ccsa, software development",3 weeks ago
"Lead, ERP Business Analyst",Schneider Electric India Pvt. Ltd.,10-15 Yrs,Bengaluru,Material Requirement planning MRP Basics MRP Results The resource should have at least ...,"Procurement, Business process, Printing, ERP, Debugging, Database administration, Regression testing, EDI",3 weeks ago
"Business Analyst I, WHS",Amazon,3-8 Yrs,Bengaluru,Help train new peers and contribute to the development of your team . Bachelors degree ...,"Computer science, Data analysis, Excel, Process efficiency, Business analytics, Machine learning, Business intelligence, Business applications",3+ weeks ago
"Business Analyst, Account Integrity",Amazon,5-10 Yrs,Bengaluru,Develop and oversee the initiation of strategy recommendations Bachelors degree in math...,"Computer science, Data analysis, SAS, Business analysis, Machine learning, Project planning, Analytics, Monitoring",3+ weeks ago
"Business Analyst, IN S&OP",Amazon,1-5 Yrs,Bengaluru,Bachelors degree or equivalent Experience defining requirements and using data and metr...,"Supply chain, Data analysis, Automation, SAS, Project management, Process improvement, Analytical, Business intelligence",3+ weeks ago
Business Analyst- Amazon India,Amazon,2-7 Yrs,"Bengaluru, Kolkata, Mumbai, New Delhi, Hyderabad, Pune, Chennai","Every day goes by requirement gathering, understanding the business problem, gaining va...","metadata, Business Analyst, Business analysis, data manipulation, Analytical, Agile, data visualization, Stakeholder management",3+ weeks ago
Business Analyst,Accenture,5-10 Yrs,Bengaluru,Educational Qualification : 15 years full time education. Summary :As a Business Analys...,"business process modeling, business analysis, business process analysis, guidewire, requirement analysis, project management, documentation, system design",3+ weeks ago
Business Analyst,Accenture,15-20 Yrs,Bengaluru,. Educational Qualification : 15 years full time education . Must have skills : SAP TM ...,"sap, sap transportation management, business solutions, business analysis, sap tm, project management, order management, gap analysis",3+ weeks ago
Business Advisory Analyst,Accenture,3-5 Yrs,Bengaluru,Qualifications: Any Graduation you re adaptable to business needs and change doesn t f...,"project management, business advisory, fintech, corporate planning, corporate strategy, management consulting, business strategy, program management",3+ weeks ago
Business Advisory Analyst,Accenture,3-5 Yrs,Bengaluru,Qualifications: Any Graduation Skill required: Trust & Safety - Anti-Money Laundering (...,"project management, business advisory, corporate planning, corporate strategy, stress analysis, management consulting, fea, business strategy",3+ weeks ago
Business System Analyst,Sun Life Global Solutions,7-12 Yrs,"Hybrid - Bengaluru(Marathahalli), Gurugram(Sector 62)","Preferred candidate profile Proficiency in privacy, risk, compliance, control, and secu...","Requirement Gathering, CCBA, BSA, Agile Methodology, Kanban, Documentation, Scrum, SQL",3+ weeks ago
Business Analyst Manager - Global Logistics,Nestle,10-15 Yrs,Bengaluru,". Bachelors degree in business, information systems, or related disciplineto motivate t...","vendor management, business analysis, stakeholder management, devops, agile, project management, management skills, supply chain",3+ weeks ago
Business Analyst,Laminaar Aviation Infotech,5-10 Yrs,Bengaluru,"Areas of Specialization: Flight Data Analysis, Fuel Optimalization, Aircraft Performanc...","Data analysis, Business Analyst, Aviation, Aerospace, Management, Analysis, Business analysis, Data",3+ weeks ago
Business Analyst - Manager - Offline Merchants ( EDC ),Paytm,4-9 Yrs,"Bengaluru, Noida",The team:Offline Payment vertical caters to our merchant partners by offering them prod...,"sql, python, data analysis, machine learning, r, hive, data mining, android",3+ weeks ago
Business Analyst - Commercial Lending & Mortgage,Capco,8-12 Yrs,"Bengaluru, Chennai",Provide subject matter expertise within the business / technical domain of Digital chan...,"confluence, soa, figma, jira, agile methodology, management consulting, lending, commercial banking",3+ weeks ago
Healthcare Business Analyst,Infosys,2-7 Yrs,Bengaluru,"MBA, MCA, MTech, Bachelor of Engineering, BCA, BTech Preferred Skills: . Domain->Health...","rpa, data analysis, hl7, agile, rcm, c#, hipaa, health insurance",3+ weeks ago
IT Business Analyst,Infineon,3-5 Yrs,Bengaluru,"Bachelor s degree in Information Technology, Computer Science, Business Administration,...","Supply chain, ERP, Data analysis, Manager Quality Assurance, SAP CRM, Agile, Troubleshooting, Information technology",3+ weeks ago
Hiring: Business Analyst,Sonata Software,7-10 Yrs,"Hybrid - Bengaluru, Hyderabad, Chennai",Experience working in Agile / Scrum environmentsRequired Skills & Qualifications: . 7+ ...,"Retail, ecommerce, Business analyat, E-commerce, Business analysis, Hiring",2 days ago
"Business Analyst, IHS and Flex",Amazon,2-5 Yrs,Bengaluru,Bachelors degree The person should also have good oral / written communication skills. ...,"Analytical skills, Automation, Excel, Business Analyst, IHS, Flex, Management, MS Office",3+ weeks ago
IT Business Analyst - Semiconductor Pricing and Quoting CRM Solutions,Infineon,3-5 Yrs,Bengaluru,We are looking for a skilled IT Business Analyst with a focus on pricing and quoting s...,"Business process, Data analysis, ERP, System support, Maintenance Manager, Forecasting, Information technology, SQL",3+ weeks ago
"Business Analyst, Cross Border Selection Technology",Amazon,3-7 Yrs,Bengaluru,Are you interested in building next generation services that will re-define internation...,"International trade, Tactical planning, Senior management, Business Analyst, Financial analysis, Analytical, Data Analyst, Customer service",3+ weeks ago
Business Intelligence Analyst,Jones Lang LaSalle,5-10 Yrs,Bengaluru,Business Intelligence Analyst Reports to: Global Programs Lead Positi...,"Data analysis, Data modeling, Analytical, Strategic planning, Data collection, data privacy, Business strategy, Investment management",1 week ago
Business Analyst ( Hands on Experience on AI Projects ),NoBroker,1-3 Yrs,Bengaluru,Requirements Currently pursuing or recently completed a Bachelors / Master s in Compute...,"AI, Python, Aiml, AI projects, Machine Learning, SQL, Artificial Intelligence, Project",1 week ago
Associate Business Systems Analyst,Haier Appliances,,"Bengaluru, Hyderabad",,,Starts in 1-3 months
Business analysis associate Business analysis associate,JPMorgan Chase Bank,5-10 Yrs,Bengaluru,"Required qualifications, capabilities, and skills Experience modelling business process...","Data analysis, Change management, Team management, Business analysis, Analytical, Data collection, Workflow, Project delivery",3+ weeks ago
"Business Analyst - I, Amazon Pay",Amazon,4-9 Yrs,Bengaluru,"Bachelors degree in Analytics, Statistics, Economics, or related field Working at the i...","Mining, Automation, Data analysis, Business analysis, Business analytics, Analytical, Machine learning, Financial services",3+ weeks ago
"Business Analyst II, NL",Amazon,3-6 Yrs,Bengaluru,"Bachelors degree or equivalent 3+ years of tax, finance or a related analytical field e...","Automation, Data analysis, metadata, query optimization, Analytical, Process improvement, Business intelligence, Data mining",3+ weeks ago
Capital Market Business Analyst,Oracle,6-8 Yrs,"Bengaluru, Kolkata, Mumbai, New Delhi, Hyderabad, Pune, Chennai","Qualifications & Skills: . Education: Masters or Bachelor s degree in finance, Business...","Data analysis, Bfsi, Back office, Business process analysis, Investment banking, Capital market, Asset management, Risk management",3+ weeks ago
"Business Analyst, Selling Partner Identity and Verification",Amazon,8-19 Yrs,Bengaluru,"Within Selling Partner Trust and Store Integrity (TSI), the Selling Partner Identity V...","Analytical skills, Data analysis, Business Analyst, Focus, Customer experience, Management, Macros, Monitoring",3+ weeks ago
Business Analyst,SLK Software,3-7 Yrs,Bengaluru,MINIMUM EXPERIENCE REQUIRED . . Mandatory / Required Skills & Location Mandatory / Requ...,"Post production, Automation, Business Analyst, Production support, Project planning, Investment management, Troubleshooting, Stakeholder management",2 weeks ago
Business Analyst,Altisource,3-8 Yrs,Bengaluru,"Experience with Scripts and Automation: Strong hands-on experience with scripting (eg, ...","Computer science, Analytical skills, Data analysis, Automation, Excel, IT projects, Operations, Reporting tools",3+ weeks ago
Business Analyst,Accenture,7-12 Yrs,Bengaluru,. Educational Qualification : 15 years full time education Qualification . 15 years ful...,"process design, business analysis, business process analysis, guidewire, brd, project management, gap analysis, business analytics",2 weeks ago
Business Analyst,Accenture,15-20 Yrs,Bengaluru,. Educational Qualification : 15 years full time education Qualification . 15 years ful...,"business analysis, business process analysis, guidewire, agile, agile methodology, project management, documentation, business analytics",2 weeks ago
Business Analyst,Accenture,5-10 Yrs,Bengaluru,Project Role :Business AnalystProject Role Description :Analyze an organization and des...,"project management, business analysis, process improvement, guidewire, agile methodology, project documentation, documentation, user stories",2 weeks ago
Business Analyst,Accenture,5-10 Yrs,Bengaluru,Project Role :Business AnalystProject Role Description :Analyze an organization and des...,"business analysis, business process analysis, guidewire, business requirement analysis, agile methodology, project management, gap analysis, documentation",2 weeks ago
Business Analyst,Capgemini,5-9 Yrs,"Hybrid - Bengaluru, Chennai","Total Exp : 5 - 9 yearsLocation : Chennai and BangaloreMandatory in hand exp : T24 , BA...","Core Banking, Business Analysis, T24, Corporate Lending, Syndicated lending, Bank Guarantee, Trade Finance, Finestra",2 weeks ago
Assistant Manager - Business Analyst,KPMG India,8-11 Yrs,Bengaluru,Experience required: . Strong understanding of capital market products and derivatives ...,"Health insurance, Data analysis, Front office, SAS, Project management, Investment banking, Capital market, Business process management",3+ weeks ago
Business Analyst L2,Wipro,3-6 Yrs,Bengaluru,Role Purpose The purpose of the role is to liaison and bridging the gap between cus...,"project management, business analysis, root cause analysis, rfi, rfp, charts, client engagement, test cases",2 weeks ago
Business Analyst,Accenture,1-4 Yrs,Bengaluru,Must have skills : Business Requirements Analysis Good to have skills : NAMinimum . 5 y...,"business process modeling, business requirement analysis, workflow automation, agile methodology, jira, project management, confluence, lucidchart",2 weeks ago
Business Analyst,Accenture,1-4 Yrs,Bengaluru,Must have skills : Business Requirements Analysis Good to have skills : NAMinimum . 5 y...,"business process modeling, confluence, business requirement analysis, workflow automation, agile methodology, lucidchart, documentation, business solutions",2 weeks ago
Business Analyst,Accenture,1-4 Yrs,Bengaluru,Must have skills : Business Requirements Analysis Good to have skills : NAMinimum . 5 y...,"business process modeling, business requirement analysis, workflow automation, agile methodology, jira, project management, confluence, lucidchart",2 weeks ago
"Business Analyst, IN Payments",Amazon,1-6 Yrs,Bengaluru,The role will cover: A)Working with program and product managers to identify defects / ...,"Automation, SAS, Business analysis, Analytical, SPSS, Customer experience, Data mining, SQL",2 weeks ago
Business Analyst,Sapiens,6-11 Yrs,Hybrid - Bengaluru,Sapiens is on the lookout for a Business Analyst to become a key player in our Bangalo...,"Property And Casualty Insurance, User Stories, Insurance Domain, North America, Requirement Gathering, Enhancements, Requirement Analysis, Implementation Cycle",2 weeks ago
Guidewire Business Analyst,Tata Consultancy Services,4-9 Yrs,"Bengaluru, Chennai, Coimbatore","Experience: 4 - 9 years Only. Education: Minimum 15 years of full time education (10th,...","Claims Processing, Billing Center, Policy Center, Guidewire Development, Guidewire, Claims, Development, Center",2 weeks ago
Business Analyst,Accenture,1-4 Yrs,Bengaluru,". Educational Qualification : 15 years full time educationAs a Business Architect, you ...","business requirement analysis, business process modeling, business process improvement, business architecture, retail, trade promotion management, business case development, business solutions",2 weeks ago
Business Interlock Analyst,Accenture,3-5 Yrs,Bengaluru,Qualifications: Any Graduation Skill required: Talent Development - Instructor-Led Trai...,"risk management, business analysis, hrsd, talent development, recruitment, hr generalist activities, corporate hr, human resource management",2 weeks ago
Business Analyst,Accenture,1-4 Yrs,Bengaluru,. Educational Qualification : 15 years full time education . Must have skills : Busines...,"business solutions, business analysis, business requirement analysis, flow diagrams, aws, process flow diagram, project management, gap analysis",2 weeks ago
Business Analyst,Accenture,12-15 Yrs,Bengaluru,. Educational Qualification : 15 years full time education . Must have skills : Java Fu...,"c insurance, javascript, software development life cycle, java, full stack, css, python, c++",2 weeks ago
Business Analyst,Accenture,3-8 Yrs,Bengaluru,Educational Qualification : 15 years full time education Must have skills : Business Re...,"project management, business solutions, business analysis, business requirement analysis, process mapping, gap analysis, business analytics, user stories",2 weeks ago
"Business Functional Analysis, AVP",Deutsche Bank,7-12 Yrs,Bengaluru,"Bachelors degree in Business, Finance, Information Systems, or a related field5+ years ...","financial services, stakeholder management, agile, agile methodology, jira, trade finance, lending, management skills",2 weeks ago
Business Analyst/Functional Consultant HR (with AI/ML knowledge),Robert Bosch Engineering and Business Solutions Private Limited,2-6 Yrs,Bengaluru,"Bachelor s or master s in human resources, Business Administration, Information Systems...","Change management, SAP, Business analysis, HRIS, Talent acquisition, Natural language processing, Oracle, Stakeholder management",2 weeks ago
Technical Business Analyst,KPMG India,4-7 Yrs,Hybrid - Bengaluru,"Bachelor or Masters degree in Maths, Computer Science or I.TExperience with Agile Scrum...","JSON, Agile Methodology, XML, Business Analysis, Analysis, Technical analysis, Agile, Technical",2 weeks ago
Business Analyst,Altisource,2-9 Yrs,Bengaluru,Altisource Business Solutions Pvt Ltd is looking for Business Analyst to join our dynam...,"vendor management, project management, documentation, business solutions, business analysis, budgeting, strategic planning, requirement gathering",3+ weeks ago
"Business Analyst, Beauty",Amazon,2-5 Yrs,Bengaluru,The ideal candidate actively seeks to understand Amazon s core business values and init...,"SAS, Business Analyst, Analytical, Design development, E-commerce, SPSS, data visualization, Data mining",3+ weeks ago
"Business Analyst I, Retail Business Services (RBS) - Brand Experience",Amazon,5-7 Yrs,Bengaluru,. An ideal candidate for this role: Will have relevant experience in data analytics wor...,"Business services, Business Analyst, Analytical, Machine learning, Agile, Selenium, data visualization, Customer experience",3+ weeks ago
Advanced Business Analyst,Novo Nordisk,2-5 Yrs,Bengaluru,Department: Finance GBS Are you passionate about financial processes and eager to drive...,"sap, analytical, stakeholder management, analysis, tools, ms office, communication skills, Management",3+ weeks ago
Business Development (M&A) Analyst,IBM,2-3 Yrs,Bengaluru,IBM Infrastructure Business Development (M&A) Executives are responsible for identifyi...,"financial analysis, project management, business development, partnerships, strategic partnerships, management consulting, mainframes, management skills",3 weeks ago
Business Systems Analysis Advisor (Certinia PSA Analyst),Quest Global,3-6 Yrs,"Bengaluru, Kolkata, Mumbai, New Delhi, Hyderabad, Pune, Chennai",Join Quest. Job seekers should be aware of fraudulent job offers from online scammers a...,"Computer science, Analytical, Active directory, Back office, Manager Technology, Wellness, data integrity, professional services",3 weeks ago
Digital Strategy - Business Analyst- Consultant,KPMG India,5-10 Yrs,Bengaluru,Minimum Education or Certification: Bachelor s Degree related to IT (MBA preferred) . T...,"Manager Quality Assurance, Business Analyst, Business analysis, Business process improvement, Analytical, Business strategy, Risk management, Stakeholder management",3+ weeks ago
Business Analyst (UK pensions and retirements),Wipro,6-11 Yrs,"Hybrid - Bengaluru, Pune, Gurugram",Key Responsibilities:Act as domain lead Business Analyst across a series of projects a...,"business analyst, Retirement, UK Savings, Pension Administration, Uk, Business analysis",3+ weeks ago
Business Advisory Analyst,Accenture,3-5 Yrs,Bengaluru,Qualifications: Any Graduation Skill required: Trust & Safety - Anti-Money Laundering (...,"project management, business advisory, corporate planning, corporate strategy, stress analysis, management consulting, fea, business strategy",3+ weeks ago
Business Analyst - L3,Wipro,3-5 Yrs,Bengaluru,Experience: 3-5 Years. . .,"rpa, project management, software testing, business analysis, root cause analysis, client engagement, documentation, test cases",3+ weeks ago
Business Analyst,Oracle,2-5 Yrs,Bengaluru,Responsible for getting certified on core process periodicallyShould be able to underst...,"Analytical skills, Business Analyst, Billing, Revenue recognition, PeopleSoft, Workflow, Management, Research",3+ weeks ago
Business Analyst,Oracle,2-5 Yrs,Bengaluru,Responsible for getting certified on core process periodically Should be able to unders...,"Analytical skills, Sales, Business Analyst, Billing, Revenue recognition, PeopleSoft, Workflow, Management",3+ weeks ago
Business Analyst - L3,Wipro,3-5 Yrs,Bengaluru,Role Purpose The purpose of the role is to liaison and bridging the gap between custo...,"project management, business analysis, root cause analysis, salesforce sales cloud, integration testing, client engagement, documentation, test cases",3+ weeks ago
Business Analyst - L4,Wipro,5-8 Yrs,Bengaluru,Role PurposeThe purpose of the role is to liaison and bridging the gap between customer...,"Oracle Retail Merchandising, project management, Integration Testing, User Acceptance, Oracle, RFP, Retail merchandising, Project",3+ weeks ago
Business Analyst (LIMS Airline Logistics & Inventory Management),Laminaar Aviation Infotech,3-5 Yrs,Bengaluru,"Areas of Specialization: Stores management, material planning procurement Education...","Procurement, Business Analyst, Aviation, Aerospace, Inventory management, Material planning, Management, MRO",3+ weeks ago
Business Analyst (ATSM: Air Traffic Staff Management),Laminaar Aviation Infotech,3-5 Yrs,Bengaluru,Areas of Specialization: Roster Management of Air Traffic Controllers in Air Traffic ...,"aviation management, Aviation, Business Analyst, Aerospace, Staff management, Management, Business analysis",3+ weeks ago
Business Analyst ( ERP Admin Module ),Laminaar Aviation Infotech,3-5 Yrs,"Bengaluru, Mumbai","Areas of Specialization: Requirements Specifications (SRS), Requirement understanding D...","Computer science, Administration, ERP, Business Analyst, Gap analysis, Management, Information technology, Gap",3+ weeks ago
Business Analyst,Laminaar Aviation Infotech,3-5 Yrs,Bengaluru,Areas of Specialization: Resource Planning Allocation in Ground Handling companies ...,"airport ground handling, Aviation, Business Analyst, Aerospace, Resource planning, Planning, Business analysis, Resource",3+ weeks ago
Business Analyst,Laminaar Aviation Infotech,5-8 Yrs,Bengaluru,Educational Qualification: Bachelors/ Masters Degree preferably Engineering with specia...,"Aviation, cargo operations, Business Analyst, Aerospace, IATA, Operations, Business analysis, Cargo",3+ weeks ago
Business Analyst HR Core,Cargill,3-5 Yrs,Bengaluru,"In this role, you will use advanced knowledge of the tasks and techniques that are used...","employee engagement, recruitment, regulatory affairs, life cycle managementdata analysis, change management, hr operations, Core, Operations",3+ weeks ago
Assistant Manager - Business Analyst,KPMG India,8-11 Yrs,Bengaluru,Demonstrates deep knowledge of the financial instrument and/or functi...,"Change management, Business Analyst, Regulatory reporting, Senior management, Financial risk, Market risk, Assistant Manager Business Analyst, Manager Technology",3+ weeks ago
Advanced Business Analyst,Novo Nordisk,12-15 Yrs,Bengaluru,Masters degree in finance (or equivalent) from a well-recognized institute with a stron...,"pc, sap bw, sap ecc, accounting, financial planning, financial planning and analysis, finance, Financial analysis",3+ weeks ago
Business Analyst - Wealth Management,Infosys,3-8 Yrs,Bengaluru,"Chartered Accountant, Master Of Business Adm., Master Of Business Management, Master Of...","business analysis, configuration management, solution design, wealth management, digital transformation, project management, team management, poc",3+ weeks ago
Business Analyst - Banking,Infosys,3-8 Yrs,Bengaluru,"Chartered Accountant, Master Of Business Management, Master Of Engineering, Master Of T...","lean, waterfall, scrum, agile, sdlc, project management, ux, business management",3+ weeks ago
Business Analyst - L3,Wipro,3-5 Yrs,Bengaluru,Solid experience with all stages and methodologies in the software development lifecycl...,"business process mapping, business analysis, system analysis, software development life cycle, ms office suite, project management, relationship building, business solutions",3+ weeks ago
Business Analyst - L5,Wipro,8-10 Yrs,Bengaluru,Role PurposeThe purpose of the role is to liaison and bridging the gap between customer...,"project management, software testing, business analysis, root cause analysis, salesforce service cloud, client engagement, test cases, change request",3+ weeks ago
Business Analyst - L4,Wipro,5-8 Yrs,Bengaluru,Experience: 5-8 Years. . .,"project management, software testing, business analysis, change request, root cause analysis, client engagement, documentation, test cases",3+ weeks ago
"Business Analyst, RBS",Amazon,4-9 Yrs,Bengaluru,"We have a broad mix of experience levels and tenures, and we re building an environment...","Supply chain, Computer science, Business process, Automation, Coding, Machine learning, Agile, Ruby",3+ weeks ago
Business Automation Analyst,Hitachi Energy,3-11 Yrs,Bengaluru,"Bachelors degree in Business, Information Systems, or a related fieldPlease include you...","Business process, Telecom, Supply chain management, Automation, Analytical, German, Spanish, SCM",3+ weeks ago
"Business Analyst, A.in Co-op Program team",Amazon,1-6 Yrs,Bengaluru,Bachelors degree - 1+ years of data analytics or automation experience 1+ years of ca...,"Automation, SAS, Business Analyst, Business analysis, Operations planning, Analytical, SPSS, Data mining",3+ weeks ago
